{"canonical_id": "wayfarer-sunglasses", "doc_id": "term-wayfarer-sunglasses", "doc_type": "term", "entity_kind": "accessory", "language": "en", "payload": {"subcategory": "sunglasses", "use_case": "sun exposure"}, "provenance": {"confidence": 0.8, "source": "FFO Seed v0.1 curation", "source_type": "AUTHORITATIVE"}, "published_at": "2026-09-21T00:00:00+00:00", "retrieved_at": "2026-09-21T00:00:00+00:00", "status": "published", "version": 1}
