{"canonical_id": "velvet", "doc_id": "term-velvet", "doc_type": "term", "entity_kind": "textile", "language": "en", "payload": {"name": "velvet", "texture": "soft pile", "warmth": "medium"}, "provenance": {"confidence": 0.85, "source": "FFO Seed v0.1 curation", "source_type": "AUTHORITATIVE"}, "published_at": "2026-09-21T00:00:00+00:00", "retrieved_at": "2026-09-21T00:00:00+00:00", "status": "published", "version": 1}
