{"canonical_id": "regular-fit", "doc_id": "term-regular-fit", "doc_type": "term", "entity_kind": "fit", "language": "en", "payload": {"name": "regular", "physical_fit": "natural drape"}, "provenance": {"confidence": 0.9, "source": "FFO Seed v0.1 curation", "source_type": "AUTHORITATIVE"}, "published_at": "2026-09-21T00:00:00+00:00", "retrieved_at": "2026-09-21T00:00:00+00:00", "status": "published", "version": 1}
