{"canonical_id": "stripe", "doc_id": "term-stripe", "doc_type": "term", "entity_kind": "pattern", "language": "en", "payload": {"direction": "horizontal", "name": "stripe", "scale": "medium"}, "provenance": {"confidence": 0.9, "source": "FFO Seed v0.1 curation", "source_type": "AUTHORITATIVE"}, "published_at": "2026-09-21T00:00:00+00:00", "retrieved_at": "2026-09-21T00:00:00+00:00", "status": "published", "version": 1}
