{"doc_id": "rule-structured-tapered", "doc_type": "rule", "language": "en", "payload": {"confidence": 0.6, "effect": "defined_shoulder_line", "when": {"bottom": "tapered", "outerwear": "structured"}}, "provenance": {"confidence": 0.6, "source": "FFO Phase 2A curated seed", "source_type": "AUTHORITATIVE"}, "published_at": "2026-09-21T00:00:00+00:00", "retrieved_at": "2026-09-21T00:00:00+00:00", "status": "draft", "version": 1}
