{"canonical_id": "silk", "doc_id": "term-silk", "doc_type": "term", "entity_kind": "material", "language": "en", "payload": {"family": "natural", "name": "silk"}, "provenance": {"confidence": 0.95, "source": "FFO Seed v0.1 curation", "source_type": "AUTHORITATIVE"}, "published_at": "2026-09-21T00:00:00+00:00", "retrieved_at": "2026-09-21T00:00:00+00:00", "status": "published", "version": 1}
