{"alias": "baggy jeans", "canonical_id": "wide_leg_jeans", "doc_id": "alias-baggy-jeans", "doc_type": "alias", "entity_kind": "garment", "language": "en", "provenance": {"confidence": 0.8, "source": "FFO Phase 2A curated seed", "source_type": "AUTHORITATIVE"}, "published_at": "2026-09-21T00:00:00+00:00", "retrieved_at": "2026-09-21T00:00:00+00:00", "status": "published", "version": 1}
