{"canonical_id": "polyester", "doc_id": "term-polyester", "doc_type": "term", "entity_kind": "material", "language": "en", "payload": {"family": "synthetic", "name": "polyester"}, "provenance": {"confidence": 0.95, "source": "FFO Seed v0.1 curation", "source_type": "AUTHORITATIVE"}, "published_at": "2026-09-21T00:00:00+00:00", "retrieved_at": "2026-09-21T00:00:00+00:00", "status": "published", "version": 1}
