{"doc_id": "rule-fitted-wide-balanced", "doc_type": "rule", "language": "en", "payload": {"confidence": 0.75, "effect": "balanced_volume", "when": {"bottom": "wide", "top": "fitted"}}, "provenance": {"confidence": 0.75, "source": "FFO Seed v0.1 curation", "source_type": "AUTHORITATIVE"}, "published_at": "2026-09-21T00:00:00+00:00", "retrieved_at": "2026-09-21T00:00:00+00:00", "status": "published", "version": 1}
