{"canonical_id": "y2k", "doc_id": "term-y2k", "doc_type": "term", "entity_kind": "aesthetic", "language": "en", "payload": {"name": "Y2K"}, "provenance": {"confidence": 0.8, "source": "FFO Seed v0.1 curation", "source_type": "AUTHORITATIVE"}, "published_at": "2026-09-21T00:00:00+00:00", "retrieved_at": "2026-09-21T00:00:00+00:00", "status": "published", "version": 1}
