{"alias": "y2k fashion", "canonical_id": "y2k", "doc_id": "alias-y2k-fashion", "doc_type": "alias", "entity_kind": "aesthetic", "language": "en", "provenance": {"confidence": 0.8, "source": "FFO Seed v0.1 curation", "source_type": "AUTHORITATIVE"}, "published_at": "2026-09-21T00:00:00+00:00", "retrieved_at": "2026-09-21T00:00:00+00:00", "status": "published", "version": 1}
