{"doc_id": "rel-belt-complements-trousers", "doc_type": "relationship", "language": "en", "object": "pleated-trousers", "provenance": {"confidence": 0.7, "source": "FFO Seed v0.1 curation", "source_type": "AUTHORITATIVE"}, "published_at": "2026-09-21T00:00:00+00:00", "rel_type": "COMPLEMENTS", "retrieved_at": "2026-09-21T00:00:00+00:00", "status": "reviewed", "subject": "leather-belt", "version": 1}
