{"alias": "polka dots", "canonical_id": "polka-dot", "doc_id": "alias-polka-dots", "doc_type": "alias", "entity_kind": "pattern", "language": "en", "provenance": {"confidence": 0.85, "source": "FFO Seed v0.1 curation", "source_type": "AUTHORITATIVE"}, "published_at": "2026-09-21T00:00:00+00:00", "retrieved_at": "2026-09-21T00:00:00+00:00", "status": "published", "version": 1}
