{"canonical_id": "charcoal", "doc_id": "term-charcoal", "doc_type": "term", "entity_kind": "color", "language": "en", "payload": {"name": "charcoal", "relationships": ["NEUTRAL"], "semantic_family": "grey"}, "provenance": {"confidence": 0.9, "source": "FFO Seed v0.1 curation", "source_type": "AUTHORITATIVE"}, "published_at": "2026-09-21T00:00:00+00:00", "retrieved_at": "2026-09-21T00:00:00+00:00", "status": "published", "version": 1}
