{"canonical_id": "leather-briefcase", "doc_id": "term-leather-briefcase", "doc_type": "term", "entity_kind": "bag", "language": "en", "payload": {"formality": "business", "material": "leather", "subcategory": "briefcase", "use_case": "work"}, "provenance": {"confidence": 0.85, "source": "FFO Seed v0.1 curation", "source_type": "AUTHORITATIVE"}, "published_at": "2026-09-21T00:00:00+00:00", "retrieved_at": "2026-09-21T00:00:00+00:00", "status": "published", "version": 1}
