{"alias": "wine", "canonical_id": "burgundy", "doc_id": "alias-wine", "doc_type": "alias", "entity_kind": "color", "language": "en", "provenance": {"confidence": 0.75, "source": "FFO Seed v0.1 curation", "source_type": "AUTHORITATIVE"}, "published_at": "2026-09-21T00:00:00+00:00", "retrieved_at": "2026-09-21T00:00:00+00:00", "status": "published", "version": 1}
