{"canonical_id": "dark-denim-jeans", "doc_id": "term-dark-denim-jeans", "doc_type": "term", "entity_kind": "garment", "language": "en", "payload": {"category": "bottoms", "fit": "slim", "material": ["denim"], "subcategory": "dark denim jeans"}, "provenance": {"confidence": 0.9, "source": "FFO Seed v0.1 curation", "source_type": "AUTHORITATIVE"}, "published_at": "2026-09-21T00:00:00+00:00", "retrieved_at": "2026-09-21T00:00:00+00:00", "status": "published", "version": 1}
