{"canonical_id": "pleated-trousers", "doc_id": "term-pleated-trousers", "doc_type": "term", "entity_kind": "garment", "language": "en", "payload": {"category": "bottoms", "fit": "regular", "material": ["wool"], "subcategory": "pleated trousers"}, "provenance": {"confidence": 0.85, "source": "FFO Seed v0.1 curation", "source_type": "AUTHORITATIVE"}, "published_at": "2026-09-21T00:00:00+00:00", "retrieved_at": "2026-09-21T00:00:00+00:00", "status": "published", "version": 1}
