{"doc_id": "rel-wide-leg-pairs-fitted-top", "doc_type": "relationship", "language": "en", "object": "fitted-top", "provenance": {"confidence": 0.7, "source": "FFO Phase 2A curated seed", "source_type": "AUTHORITATIVE"}, "published_at": "2026-09-21T00:00:00+00:00", "rel_type": "PAIRS_WITH", "retrieved_at": "2026-09-21T00:00:00+00:00", "status": "reviewed", "subject": "wide_leg_jeans", "version": 1}
