{"canonical_id": "chelsea-boots", "doc_id": "term-chelsea-boots", "doc_type": "term", "entity_kind": "footwear", "language": "en", "payload": {"formality": "smart-casual", "material": "leather", "subcategory": "Chelsea boot"}, "provenance": {"confidence": 0.9, "source": "FFO Seed v0.1 curation", "source_type": "AUTHORITATIVE"}, "published_at": "2026-09-21T00:00:00+00:00", "retrieved_at": "2026-09-21T00:00:00+00:00", "status": "published", "version": 1}
